1.002112 ARP, Request who-has 10.1.1.1 (ff:ff:ff:ff:ff:ff) tell 10.1.1.5, length 32
1.002227 ARP, Reply 10.1.1.1 is-at 00:00:00:00:00:01, length 32
1.002399 Acknowledgment RA:00:00:00:00:00:01 
1.002617 IP 10.1.1.5.49153 > 10.1.1.1.9999: Flags [S], seq 0, win 65535, options [TS val 1000 ecr 0,wscale 2,sackOK,eol], length 0
1.002633 Acknowledgment RA:00:00:00:00:00:05 
1.003112 ARP, Request who-has 10.1.1.1 (ff:ff:ff:ff:ff:ff) tell 10.1.1.3, length 32
1.003200 ARP, Reply 10.1.1.1 is-at 00:00:00:00:00:01, length 32
1.003372 Acknowledgment RA:00:00:00:00:00:01 
1.003608 IP 10.1.1.3.49153 > 10.1.1.1.9999: Flags [S], seq 0, win 65535, options [TS val 1000 ecr 0,wscale 2,sackOK,eol], length 0
1.003624 Acknowledgment RA:00:00:00:00:00:03 
1.005112 ARP, Request who-has 10.1.1.1 (ff:ff:ff:ff:ff:ff) tell 10.1.1.2, length 32
1.005254 ARP, Reply 10.1.1.1 is-at 00:00:00:00:00:01, length 32
1.005426 Acknowledgment RA:00:00:00:00:00:01 
1.005635 IP 10.1.1.2.49153 > 10.1.1.1.9999: Flags [S], seq 0, win 65535, options [TS val 1000 ecr 0,wscale 2,sackOK,eol], length 0
1.005651 Acknowledgment RA:00:00:00:00:00:02 
1.006608 ARP, Request who-has 10.1.1.3 (ff:ff:ff:ff:ff:ff) tell 10.1.1.1, length 32
1.006929 ARP, Reply 10.1.1.3 is-at 00:00:00:00:00:03, length 32
1.006945 Acknowledgment RA:00:00:00:00:00:03 
1.007041 ARP, Request who-has 10.1.1.2 (ff:ff:ff:ff:ff:ff) tell 10.1.1.1, length 32
1.007326 ARP, Reply 10.1.1.2 is-at 00:00:00:00:00:02, length 32
1.007342 Acknowledgment RA:00:00:00:00:00:02 
1.007614 ARP, Request who-has 10.1.1.1 (ff:ff:ff:ff:ff:ff) tell 10.1.1.4, length 32
1.007675 IP 10.1.1.1.9999 > 10.1.1.3.49153: Flags [S.], seq 0, ack 1, win 65535, options [TS val 1003 ecr 1000,wscale 2,sackOK,eol], length 0
1.007883 Acknowledgment RA:00:00:00:00:00:01 
1.008133 IP 10.1.1.3.49153 > 10.1.1.1.9999: Flags [.], ack 1, win 32768, options [TS val 1007 ecr 1003,eol], length 0
1.008149 Acknowledgment RA:00:00:00:00:00:03 
1.008245 IP 10.1.1.1.9999 > 10.1.1.2.49153: Flags [S.], seq 0, ack 1, win 65535, options [TS val 1005 ecr 1000,wscale 2,sackOK,eol], length 0
1.008453 Acknowledgment RA:00:00:00:00:00:01 
1.008667 IP 10.1.1.2.49153 > 10.1.1.1.9999: Flags [.], ack 1, win 32768, options [TS val 1008 ecr 1005,eol], length 0
1.008683 Acknowledgment RA:00:00:00:00:00:02 
1.009648 IP 10.1.1.2.49153 > 10.1.1.1.9999: Flags [.], seq 1:513, ack 1, win 32768, options [TS val 1008 ecr 1005,eol], length 512
1.009664 Acknowledgment RA:00:00:00:00:00:02 
1.009760 ARP, Reply 10.1.1.1 is-at 00:00:00:00:00:01, length 32
1.009933 Acknowledgment RA:00:00:00:00:00:01 
1.010039 ARP, Request who-has 10.1.1.5 (ff:ff:ff:ff:ff:ff) tell 10.1.1.1, length 32
1.011018 IP 10.1.1.3.49153 > 10.1.1.1.9999: Flags [.], seq 1:513, ack 1, win 32768, options [TS val 1008 ecr 1003,eol], length 512
1.011034 Acknowledgment RA:00:00:00:00:00:03 
1.011130 IP 10.1.1.1.9999 > 10.1.1.2.49153: Flags [.], ack 513, win 32768, options [TS val 1009 ecr 1008,eol], length 0
1.011334 Acknowledgment RA:00:00:00:00:00:01 
1.011498 ARP, Reply 10.1.1.5 is-at 00:00:00:00:00:05, length 32
1.011514 Acknowledgment RA:00:00:00:00:00:05 
1.011691 IP 10.1.1.1.9999 > 10.1.1.3.49153: Flags [.], ack 513, win 32768, options [TS val 1011 ecr 1008,eol], length 0
1.011896 Acknowledgment RA:00:00:00:00:00:01 
1.012105 IP 10.1.1.4.49153 > 10.1.1.1.9999: Flags [S], seq 0, win 65535, options [TS val 1000 ecr 0,wscale 2,sackOK,eol], length 0
1.012121 Acknowledgment RA:00:00:00:00:00:04 
1.012289 IP 10.1.1.1.9999 > 10.1.1.5.49153: Flags [S.], seq 0, ack 1, win 65535, options [TS val 1002 ecr 1000,wscale 2,sackOK,eol], length 0
1.012497 Acknowledgment RA:00:00:00:00:00:01 
1.012801 IP 10.1.1.5.49153 > 10.1.1.1.9999: Flags [.], ack 1, win 32768, options [TS val 1012 ecr 1002,eol], length 0
1.012817 Acknowledgment RA:00:00:00:00:00:05 
1.013828 IP 10.1.1.5.49153 > 10.1.1.1.9999: Flags [.], seq 1:513, ack 1, win 32768, options [TS val 1012 ecr 1002,eol], length 512
1.013844 Acknowledgment RA:00:00:00:00:00:05 
1.014039 IP 10.1.1.1.9999 > 10.1.1.5.49153: Flags [.], ack 513, win 32768, options [TS val 1013 ecr 1012,eol], length 0
1.014243 Acknowledgment RA:00:00:00:00:00:01 
1.017208 IP 10.1.1.2.49153 > 10.1.1.1.9999: Flags [.], seq 513:1025, ack 1, win 32768, options [TS val 1016 ecr 1009,eol], length 512
1.017224 Acknowledgment RA:00:00:00:00:00:02 
1.018312 IP 10.1.1.5.49153 > 10.1.1.1.9999: Flags [.], seq 513:1025, ack 1, win 32768, options [TS val 1016 ecr 1013,eol], length 512
1.018328 Acknowledgment RA:00:00:00:00:00:05 
1.019284 IP 10.1.1.3.49153 > 10.1.1.1.9999: Flags [.], seq 513:1025, ack 1, win 32768, options [TS val 1016 ecr 1011,eol], length 512
1.019300 Acknowledgment RA:00:00:00:00:00:03 
1.019396 ARP, Request who-has 10.1.1.4 (ff:ff:ff:ff:ff:ff) tell 10.1.1.1, length 32
1.019690 ARP, Reply 10.1.1.4 is-at 00:00:00:00:00:04, length 32
1.019706 Acknowledgment RA:00:00:00:00:00:04 
1.019829 IP 10.1.1.1.9999 > 10.1.1.4.49153: Flags [S.], seq 0, ack 1, win 65535, options [TS val 1012 ecr 1000,wscale 2,sackOK,eol], length 0
1.020038 Acknowledgment RA:00:00:00:00:00:01 
1.020279 IP 10.1.1.4.49153 > 10.1.1.1.9999: Flags [.], ack 1, win 32768, options [TS val 1019 ecr 1012,eol], length 0
1.020295 Acknowledgment RA:00:00:00:00:00:04 
1.021283 IP 10.1.1.4.49153 > 10.1.1.1.9999: Flags [.], seq 1:537, ack 1, win 32768, options [TS val 1019 ecr 1012,eol], length 536
1.021299 Acknowledgment RA:00:00:00:00:00:04 
1.021422 IP 10.1.1.1.9999 > 10.1.1.4.49153: Flags [.], ack 537, win 32768, options [TS val 1021 ecr 1019,eol], length 0
1.021627 Acknowledgment RA:00:00:00:00:00:01 
1.022525 IP 10.1.1.4.49153 > 10.1.1.1.9999: Flags [.], seq 537:1025, ack 1, win 32768, options [TS val 1021 ecr 1021,eol], length 488
1.022541 Acknowledgment RA:00:00:00:00:00:04 
1.025400 IP 10.1.1.4.49153 > 10.1.1.1.9999: Flags [.], seq 1025:1537, ack 1, win 32768, options [TS val 1024 ecr 1021,eol], length 512
1.025416 Acknowledgment RA:00:00:00:00:00:04 
1.025557 IP 10.1.1.1.9999 > 10.1.1.4.49153: Flags [.], ack 1537, win 32768, options [TS val 1025 ecr 1021,eol], length 0
1.025761 Acknowledgment RA:00:00:00:00:00:01 
1.033592 IP 10.1.1.4.49153 > 10.1.1.1.9999: Flags [.], seq 1537:2049, ack 1, win 32768, options [TS val 1032 ecr 1025,eol], length 512
1.033608 Acknowledgment RA:00:00:00:00:00:04 
1.041784 IP 10.1.1.4.49153 > 10.1.1.1.9999: Flags [.], seq 2049:2561, ack 1, win 32768, options [TS val 1040 ecr 1025,eol], length 512
1.041800 Acknowledgment RA:00:00:00:00:00:04 
1.041914 IP 10.1.1.1.9999 > 10.1.1.4.49153: Flags [.], ack 2561, win 32768, options [TS val 1041 ecr 1032,eol], length 0
1.042118 Acknowledgment RA:00:00:00:00:00:01 
1.049976 IP 10.1.1.4.49153 > 10.1.1.1.9999: Flags [.], seq 2561:3073, ack 1, win 32768, options [TS val 1049 ecr 1041,eol], length 512
1.049992 Acknowledgment RA:00:00:00:00:00:04 
1.058168 IP 10.1.1.4.49153 > 10.1.1.1.9999: Flags [.], seq 3073:3585, ack 1, win 32768, options [TS val 1057 ecr 1041,eol], length 512
1.058184 Acknowledgment RA:00:00:00:00:00:04 
1.058361 IP 10.1.1.1.9999 > 10.1.1.4.49153: Flags [.], ack 3585, win 32768, options [TS val 1058 ecr 1049,eol], length 0
1.058565 Acknowledgment RA:00:00:00:00:00:01 
1.066360 IP 10.1.1.4.49153 > 10.1.1.1.9999: Flags [.], seq 3585:4097, ack 1, win 32768, options [TS val 1065 ecr 1058,eol], length 512
1.066376 Acknowledgment RA:00:00:00:00:00:04 
1.074552 IP 10.1.1.4.49153 > 10.1.1.1.9999: Flags [.], seq 4097:4609, ack 1, win 32768, options [TS val 1073 ecr 1058,eol], length 512
1.074568 Acknowledgment RA:00:00:00:00:00:04 
1.074682 IP 10.1.1.1.9999 > 10.1.1.4.49153: Flags [.], ack 4609, win 32768, options [TS val 1074 ecr 1065,eol], length 0
1.074886 Acknowledgment RA:00:00:00:00:00:01 
1.082744 IP 10.1.1.4.49153 > 10.1.1.1.9999: Flags [.], seq 4609:5121, ack 1, win 32768, options [TS val 1081 ecr 1074,eol], length 512
1.082760 Acknowledgment RA:00:00:00:00:00:04 
1.090936 IP 10.1.1.4.49153 > 10.1.1.1.9999: Flags [.], seq 5121:5633, ack 1, win 32768, options [TS val 1090 ecr 1074,eol], length 512
1.090952 Acknowledgment RA:00:00:00:00:00:04 
1.091039 IP 10.1.1.1.9999 > 10.1.1.4.49153: Flags [.], ack 5633, win 32768, options [TS val 1090 ecr 1081,eol], length 0
1.091243 Acknowledgment RA:00:00:00:00:00:01 
1.099128 IP 10.1.1.4.49153 > 10.1.1.1.9999: Flags [.], seq 5633:6145, ack 1, win 32768, options [TS val 1098 ecr 1090,eol], length 512
1.099144 Acknowledgment RA:00:00:00:00:00:04 
1.107320 IP 10.1.1.4.49153 > 10.1.1.1.9999: Flags [.], seq 6145:6657, ack 1, win 32768, options [TS val 1106 ecr 1090,eol], length 512
1.107336 Acknowledgment RA:00:00:00:00:00:04 
1.107414 IP 10.1.1.1.9999 > 10.1.1.4.49153: Flags [.], ack 6657, win 32768, options [TS val 1107 ecr 1098,eol], length 0
1.107618 Acknowledgment RA:00:00:00:00:00:01 
1.115512 IP 10.1.1.4.49153 > 10.1.1.1.9999: Flags [.], seq 6657:7169, ack 1, win 32768, options [TS val 1114 ecr 1107,eol], length 512
1.115528 Acknowledgment RA:00:00:00:00:00:04 
1.123704 IP 10.1.1.4.49153 > 10.1.1.1.9999: Flags [.], seq 7169:7681, ack 1, win 32768, options [TS val 1122 ecr 1107,eol], length 512
1.123720 Acknowledgment RA:00:00:00:00:00:04 
1.123906 IP 10.1.1.1.9999 > 10.1.1.4.49153: Flags [.], ack 7681, win 32768, options [TS val 1123 ecr 1114,eol], length 0
1.124110 Acknowledgment RA:00:00:00:00:00:01 
1.131896 IP 10.1.1.4.49153 > 10.1.1.1.9999: Flags [.], seq 7681:8193, ack 1, win 32768, options [TS val 1131 ecr 1123,eol], length 512
1.131912 Acknowledgment RA:00:00:00:00:00:04 
1.140088 IP 10.1.1.4.49153 > 10.1.1.1.9999: Flags [.], seq 8193:8705, ack 1, win 32768, options [TS val 1139 ecr 1123,eol], length 512
1.140104 Acknowledgment RA:00:00:00:00:00:04 
1.140254 IP 10.1.1.1.9999 > 10.1.1.4.49153: Flags [.], ack 8705, win 32768, options [TS val 1140 ecr 1131,eol], length 0
1.140458 Acknowledgment RA:00:00:00:00:00:01 
1.148280 IP 10.1.1.4.49153 > 10.1.1.1.9999: Flags [.], seq 8705:9217, ack 1, win 32768, options [TS val 1147 ecr 1140,eol], length 512
1.148296 Acknowledgment RA:00:00:00:00:00:04 
1.156472 IP 10.1.1.4.49153 > 10.1.1.1.9999: Flags [.], seq 9217:9729, ack 1, win 32768, options [TS val 1155 ecr 1140,eol], length 512
1.156488 Acknowledgment RA:00:00:00:00:00:04 
1.156611 IP 10.1.1.1.9999 > 10.1.1.4.49153: Flags [.], ack 9729, win 32768, options [TS val 1156 ecr 1147,eol], length 0
1.156815 Acknowledgment RA:00:00:00:00:00:01 
1.164664 IP 10.1.1.4.49153 > 10.1.1.1.9999: Flags [.], seq 9729:10241, ack 1, win 32768, options [TS val 1163 ecr 1156,eol], length 512
1.164680 Acknowledgment RA:00:00:00:00:00:04 
1.172856 IP 10.1.1.4.49153 > 10.1.1.1.9999: Flags [.], seq 10241:10753, ack 1, win 32768, options [TS val 1172 ecr 1156,eol], length 512
1.172872 Acknowledgment RA:00:00:00:00:00:04 
1.172968 IP 10.1.1.1.9999 > 10.1.1.4.49153: Flags [.], ack 10753, win 32768, options [TS val 1172 ecr 1163,eol], length 0
1.173172 Acknowledgment RA:00:00:00:00:00:01 
1.181048 IP 10.1.1.4.49153 > 10.1.1.1.9999: Flags [.], seq 10753:11265, ack 1, win 32768, options [TS val 1180 ecr 1172,eol], length 512
1.181064 Acknowledgment RA:00:00:00:00:00:04 
1.189240 IP 10.1.1.4.49153 > 10.1.1.1.9999: Flags [.], seq 11265:11777, ack 1, win 32768, options [TS val 1188 ecr 1172,eol], length 512
1.189256 Acknowledgment RA:00:00:00:00:00:04 
1.189388 IP 10.1.1.1.9999 > 10.1.1.4.49153: Flags [.], ack 11777, win 32768, options [TS val 1189 ecr 1180,eol], length 0
1.189592 Acknowledgment RA:00:00:00:00:00:01 
1.197432 IP 10.1.1.4.49153 > 10.1.1.1.9999: Flags [.], seq 11777:12289, ack 1, win 32768, options [TS val 1196 ecr 1189,eol], length 512
1.197448 Acknowledgment RA:00:00:00:00:00:04 
1.205624 IP 10.1.1.4.49153 > 10.1.1.1.9999: Flags [.], seq 12289:12801, ack 1, win 32768, options [TS val 1204 ecr 1189,eol], length 512
1.205640 Acknowledgment RA:00:00:00:00:00:04 
1.205754 IP 10.1.1.1.9999 > 10.1.1.4.49153: Flags [.], ack 12801, win 32768, options [TS val 1205 ecr 1196,eol], length 0
1.205958 Acknowledgment RA:00:00:00:00:00:01 
1.213816 IP 10.1.1.4.49153 > 10.1.1.1.9999: Flags [.], seq 12801:13313, ack 1, win 32768, options [TS val 1212 ecr 1205,eol], length 512
1.213832 Acknowledgment RA:00:00:00:00:00:04 
1.217208 IP 10.1.1.1.9999 > 10.1.1.2.49153: Flags [.], ack 1025, win 32768, options [TS val 1217 ecr 1016,eol], length 0
1.217412 Acknowledgment RA:00:00:00:00:00:01 
1.218410 IP 10.1.1.2.49153 > 10.1.1.1.9999: Flags [.], seq 1025:1561, ack 1, win 32768, options [TS val 1217 ecr 1217,eol], length 536
1.218426 Acknowledgment RA:00:00:00:00:00:02 
1.219396 IP 10.1.1.2.49153 > 10.1.1.1.9999: Flags [.], seq 1561:2097, ack 1, win 32768, options [TS val 1217 ecr 1217,eol], length 536
1.219412 Acknowledgment RA:00:00:00:00:00:02 
1.219526 IP 10.1.1.1.9999 > 10.1.1.5.49153: Flags [.], ack 1025, win 32768, options [TS val 1218 ecr 1016,eol], length 0
1.219730 Acknowledgment RA:00:00:00:00:00:01 
1.220656 IP 10.1.1.5.49153 > 10.1.1.1.9999: Flags [.], seq 1025:1561, ack 1, win 32768, options [TS val 1219 ecr 1218,eol], length 536
1.220672 Acknowledgment RA:00:00:00:00:00:05 
1.220759 IP 10.1.1.1.9999 > 10.1.1.3.49153: Flags [.], ack 1025, win 32768, options [TS val 1219 ecr 1016,eol], length 0
1.220964 Acknowledgment RA:00:00:00:00:00:01 
1.221899 IP 10.1.1.3.49153 > 10.1.1.1.9999: Flags [.], seq 1025:1561, ack 1, win 32768, options [TS val 1220 ecr 1219,eol], length 536
1.221915 Acknowledgment RA:00:00:00:00:00:03 
1.222029 IP 10.1.1.1.9999 > 10.1.1.2.49153: Flags [.], ack 2097, win 32768, options [TS val 1219 ecr 1217,eol], length 0
1.222233 Acknowledgment RA:00:00:00:00:00:01 
1.223150 IP 10.1.1.5.49153 > 10.1.1.1.9999: Flags [.], seq 1561:2097, ack 1, win 32768, options [TS val 1219 ecr 1218,eol], length 536
1.223166 Acknowledgment RA:00:00:00:00:00:05 
1.224096 IP 10.1.1.4.49153 > 10.1.1.1.9999: Flags [.], seq 13313:13825, ack 1, win 32768, options [TS val 1221 ecr 1205,eol], length 512
1.224112 Acknowledgment RA:00:00:00:00:00:04 
1.224199 IP 10.1.1.1.9999 > 10.1.1.5.49153: Flags [.], ack 2097, win 32768, options [TS val 1223 ecr 1219,eol], length 0
1.225972 IP 10.1.1.2.49153 > 10.1.1.1.9999: Flags [.], seq 2097:2633, ack 1, win 32768, options [TS val 1222 ecr 1219,eol], length 536
1.225988 Acknowledgment RA:00:00:00:00:00:02 
1.226084 IP 10.1.1.1.9999 > 10.1.1.5.49153: Flags [.], ack 2097, win 32768, options [TS val 1223 ecr 1219,eol], length 0
1.226288 Acknowledgment RA:00:00:00:00:00:01 
1.226331 IP 10.1.1.1.9999 > 10.1.1.4.49153: Flags [.], ack 13825, win 32768, options [TS val 1224 ecr 1212,eol], length 0
1.226536 Acknowledgment RA:00:00:00:00:00:01 
1.227525 IP 10.1.1.2.49153 > 10.1.1.1.9999: Flags [.], seq 2633:3169, ack 1, win 32768, options [TS val 1222 ecr 1219,eol], length 536
1.227541 Acknowledgment RA:00:00:00:00:00:02 
1.228484 IP 10.1.1.3.49153 > 10.1.1.1.9999: Flags [.], seq 1561:2097, ack 1, win 32768, options [TS val 1220 ecr 1219,eol], length 536
1.228500 Acknowledgment RA:00:00:00:00:00:03 
1.228587 IP 10.1.1.1.9999 > 10.1.1.2.49153: Flags [.], ack 3169, win 32768, options [TS val 1227 ecr 1222,eol], length 0
1.228791 Acknowledgment RA:00:00:00:00:00:01 
1.230365 IP 10.1.1.4.49153 > 10.1.1.1.9999: Flags [.], seq 13825:14337, ack 1, win 32768, options [TS val 1229 ecr 1224,eol], length 512
1.230381 Acknowledgment RA:00:00:00:00:00:04 
1.230495 IP 10.1.1.1.9999 > 10.1.1.3.49153: Flags [.], ack 2097, win 32768, options [TS val 1228 ecr 1220,eol], length 0
1.230699 Acknowledgment RA:00:00:00:00:00:01 
1.231607 IP 10.1.1.2.49153 > 10.1.1.1.9999: Flags [.], seq 3169:3705, ack 1, win 32768, options [TS val 1222 ecr 1219,eol], length 536
1.231623 Acknowledgment RA:00:00:00:00:00:02 
1.232566 IP 10.1.1.3.49153 > 10.1.1.1.9999: Flags [.], seq 2097:2633, ack 1, win 32768, options [TS val 1230 ecr 1228,eol], length 536
1.232582 Acknowledgment RA:00:00:00:00:00:03 
1.233534 IP 10.1.1.3.49153 > 10.1.1.1.9999: Flags [.], seq 2633:3169, ack 1, win 32768, options [TS val 1230 ecr 1228,eol], length 536
1.233550 Acknowledgment RA:00:00:00:00:00:03 
1.234494 IP 10.1.1.3.49153 > 10.1.1.1.9999: Flags [.], seq 3169:3705, ack 1, win 32768, options [TS val 1230 ecr 1228,eol], length 536
1.234510 Acknowledgment RA:00:00:00:00:00:03 
1.234597 IP 10.1.1.1.9999 > 10.1.1.3.49153: Flags [.], ack 3169, win 32768, options [TS val 1233 ecr 1230,eol], length 0
1.234801 Acknowledgment RA:00:00:00:00:00:01 
1.235763 IP 10.1.1.3.49153 > 10.1.1.1.9999: Flags [.], seq 3705:4241, ack 1, win 32768, options [TS val 1234 ecr 1233,eol], length 536
1.235779 Acknowledgment RA:00:00:00:00:00:03 
1.235866 IP 10.1.1.1.9999 > 10.1.1.3.49153: Flags [.], ack 4241, win 32768, options [TS val 1235 ecr 1230,eol], length 0
1.236070 Acknowledgment RA:00:00:00:00:00:01 
1.236969 IP 10.1.1.2.49153 > 10.1.1.1.9999: Flags [.], seq 3705:4241, ack 1, win 32768, options [TS val 1228 ecr 1227,eol], length 536
1.236985 Acknowledgment RA:00:00:00:00:00:02 
1.237135 IP 10.1.1.1.9999 > 10.1.1.2.49153: Flags [.], ack 4241, win 32768, options [TS val 1236 ecr 1222,eol], length 0
1.237339 Acknowledgment RA:00:00:00:00:00:01 
1.238257 IP 10.1.1.3.49153 > 10.1.1.1.9999: Flags [.], seq 4241:4777, ack 1, win 32768, options [TS val 1234 ecr 1233,eol], length 536
1.238273 Acknowledgment RA:00:00:00:00:00:03 
1.239184 IP 10.1.1.4.49153 > 10.1.1.1.9999: Flags [.], seq 14337:14849, ack 1, win 32768, options [TS val 1237 ecr 1224,eol], length 512
1.239200 Acknowledgment RA:00:00:00:00:00:04 
1.239287 IP 10.1.1.1.9999 > 10.1.1.4.49153: Flags [.], ack 14849, win 32768, options [TS val 1239 ecr 1229,eol], length 0
1.239491 Acknowledgment RA:00:00:00:00:00:01 
1.240390 IP 10.1.1.2.49153 > 10.1.1.1.9999: Flags [.], seq 4241:4777, ack 1, win 32768, options [TS val 1228 ecr 1227,eol], length 536
1.240406 Acknowledgment RA:00:00:00:00:00:02 
1.241359 IP 10.1.1.3.49153 > 10.1.1.1.9999: Flags [.], seq 4777:5313, ack 1, win 32768, options [TS val 1234 ecr 1233,eol], length 536
1.241375 Acknowledgment RA:00:00:00:00:00:03 
1.241489 IP 10.1.1.1.9999 > 10.1.1.3.49153: Flags [.], ack 5313, win 32768, options [TS val 1241 ecr 1234,eol], length 0
1.241693 Acknowledgment RA:00:00:00:00:00:01 
1.242637 IP 10.1.1.2.49153 > 10.1.1.1.9999: Flags [.], seq 4777:5313, ack 1, win 32768, options [TS val 1228 ecr 1227,eol], length 536
1.242653 Acknowledgment RA:00:00:00:00:00:02 
1.242758 IP 10.1.1.1.9999 > 10.1.1.2.49153: Flags [.], ack 5313, win 32768, options [TS val 1242 ecr 1228,eol], length 0
1.242962 Acknowledgment RA:00:00:00:00:00:01 
1.243861 IP 10.1.1.2.49153 > 10.1.1.1.9999: Flags [.], seq 5313:5849, ack 1, win 32768, options [TS val 1237 ecr 1236,eol], length 536
1.243877 Acknowledgment RA:00:00:00:00:00:02 
1.244829 IP 10.1.1.3.49153 > 10.1.1.1.9999: Flags [.], seq 5313:5849, ack 1, win 32768, options [TS val 1236 ecr 1235,eol], length 536
1.244845 Acknowledgment RA:00:00:00:00:00:03 
1.245798 IP 10.1.1.3.49153 > 10.1.1.1.9999: Flags [.], seq 5849:6385, ack 1, win 32768, options [TS val 1236 ecr 1235,eol], length 536
1.245814 Acknowledgment RA:00:00:00:00:00:03 
1.245946 IP 10.1.1.1.9999 > 10.1.1.3.49153: Flags [.], ack 6385, win 32768, options [TS val 1245 ecr 1236,eol], length 0
1.246150 Acknowledgment RA:00:00:00:00:00:01 
1.247049 IP 10.1.1.3.49153 > 10.1.1.1.9999: Flags [.], seq 6385:6921, ack 1, win 32768, options [TS val 1236 ecr 1235,eol], length 536
1.247065 Acknowledgment RA:00:00:00:00:00:03 
1.248008 IP 10.1.1.2.49153 > 10.1.1.1.9999: Flags [.], seq 5849:6385, ack 1, win 32768, options [TS val 1237 ecr 1236,eol], length 536
1.248024 Acknowledgment RA:00:00:00:00:00:02 
1.248944 IP 10.1.1.4.49153 > 10.1.1.1.9999: Flags [.], seq 14849:15361, ack 1, win 32768, options [TS val 1245 ecr 1239,eol], length 512
1.248960 Acknowledgment RA:00:00:00:00:00:04 
1.249904 IP 10.1.1.3.49153 > 10.1.1.1.9999: Flags [.], seq 6921:7457, ack 1, win 32768, options [TS val 1241 ecr 1241,eol], length 536
1.249920 Acknowledgment RA:00:00:00:00:00:03 
1.250899 IP 10.1.1.3.49153 > 10.1.1.1.9999: Flags [.], seq 7457:7993, ack 1, win 32768, options [TS val 1241 ecr 1241,eol], length 536
1.250915 Acknowledgment RA:00:00:00:00:00:03 
1.251038 IP 10.1.1.1.9999 > 10.1.1.2.49153: Flags [.], ack 6385, win 32768, options [TS val 1248 ecr 1237,eol], length 0
1.251242 Acknowledgment RA:00:00:00:00:00:01 
1.252141 IP 10.1.1.2.49153 > 10.1.1.1.9999: Flags [.], seq 6385:6921, ack 1, win 32768, options [TS val 1237 ecr 1236,eol], length 536
1.252157 Acknowledgment RA:00:00:00:00:00:02 
1.252253 IP 10.1.1.1.9999 > 10.1.1.3.49153: Flags [.], ack 7457, win 32768, options [TS val 1249 ecr 1236,eol], length 0
1.252457 Acknowledgment RA:00:00:00:00:00:01 
1.253383 IP 10.1.1.3.49153 > 10.1.1.1.9999: Flags [.], seq 7993:8529, ack 1, win 32768, options [TS val 1241 ecr 1241,eol], length 536
1.253399 Acknowledgment RA:00:00:00:00:00:03 
1.254352 IP 10.1.1.3.49153 > 10.1.1.1.9999: Flags [.], seq 8529:9065, ack 1, win 32768, options [TS val 1246 ecr 1245,eol], length 536
1.254368 Acknowledgment RA:00:00:00:00:00:03 
1.255297 IP 10.1.1.4.49153 > 10.1.1.1.9999: Flags [.], seq 15361:15873, ack 1, win 32768, options [TS val 1253 ecr 1239,eol], length 512
1.255313 Acknowledgment RA:00:00:00:00:00:04 
1.256265 IP 10.1.1.2.49153 > 10.1.1.1.9999: Flags [.], seq 6921:7457, ack 1, win 32768, options [TS val 1242 ecr 1242,eol], length 536
1.256281 Acknowledgment RA:00:00:00:00:00:02 
1.257242 IP 10.1.1.2.49153 > 10.1.1.1.9999: Flags [.], seq 7457:7993, ack 1, win 32768, options [TS val 1242 ecr 1242,eol], length 536
1.257258 Acknowledgment RA:00:00:00:00:00:02 
1.258211 IP 10.1.1.5.49153 > 10.1.1.1.9999: Flags [.], seq 2097:2633, ack 1, win 32768, options [TS val 1226 ecr 1223,eol], length 536
1.258227 Acknowledgment RA:00:00:00:00:00:05 
1.259179 IP 10.1.1.2.49153 > 10.1.1.1.9999: Flags [.], seq 7993:8529, ack 1, win 32768, options [TS val 1242 ecr 1242,eol], length 536
1.259195 Acknowledgment RA:00:00:00:00:00:02 
1.259282 IP 10.1.1.1.9999 > 10.1.1.3.49153: Flags [.], ack 8529, win 32768, options [TS val 1253 ecr 1241,eol], length 0
1.261073 IP 10.1.1.2.49153 > 10.1.1.1.9999: Flags [.], seq 8529:9065, ack 1, win 32768, options [TS val 1251 ecr 1248,eol], length 536
1.261089 Acknowledgment RA:00:00:00:00:00:02 
1.262069 IP 10.1.1.2.49153 > 10.1.1.1.9999: Flags [.], seq 9065:9601, ack 1, win 32768, options [TS val 1251 ecr 1248,eol], length 536
1.262085 Acknowledgment RA:00:00:00:00:00:02 
1.263028 IP 10.1.1.3.49153 > 10.1.1.1.9999: Flags [.], seq 9065:9601, ack 1, win 32768, options [TS val 1246 ecr 1245,eol], length 536
1.263044 Acknowledgment RA:00:00:00:00:00:03 
1.264032 IP 10.1.1.2.49153 > 10.1.1.1.9999: Flags [.], seq 9601:10137, ack 1, win 32768, options [TS val 1251 ecr 1248,eol], length 536
1.264048 Acknowledgment RA:00:00:00:00:00:02 
1.264968 IP 10.1.1.4.49153 > 10.1.1.1.9999: Flags [.], seq 15873:16385, ack 1, win 32768, options [TS val 1262 ecr 1239,eol], length 512
1.264984 Acknowledgment RA:00:00:00:00:00:04 
1.265955 IP 10.1.1.3.49153 > 10.1.1.1.9999: Flags [.], seq 9601:10137, ack 1, win 32768, options [TS val 1246 ecr 1245,eol], length 536
1.265971 Acknowledgment RA:00:00:00:00:00:03 
1.266058 IP 10.1.1.1.9999 > 10.1.1.3.49153: Flags [.], ack 8529, win 32768, options [TS val 1253 ecr 1241,eol], length 0
1.266262 Acknowledgment RA:00:00:00:00:00:01 
1.267206 IP 10.1.1.3.49153 > 10.1.1.1.9999: Flags [.], seq 10137:10673, ack 1, win 32768, options [TS val 1252 ecr 1249,eol], length 536
1.267222 Acknowledgment RA:00:00:00:00:00:03 
1.268183 IP 10.1.1.5.49153 > 10.1.1.1.9999: Flags [.], seq 2633:3169, ack 1, win 32768, options [TS val 1226 ecr 1223,eol], length 536
1.268199 Acknowledgment RA:00:00:00:00:00:05 
1.269152 IP 10.1.1.3.49153 > 10.1.1.1.9999: Flags [.], seq 10673:11209, ack 1, win 32768, options [TS val 1252 ecr 1249,eol], length 536
1.269168 Acknowledgment RA:00:00:00:00:00:03 
1.269264 IP 10.1.1.1.9999 > 10.1.1.4.49153: Flags [.], ack 15873, win 32768, options [TS val 1255 ecr 1245,eol], length 0
1.269468 Acknowledgment RA:00:00:00:00:00:01 
1.270376 IP 10.1.1.5.49153 > 10.1.1.1.9999: Flags [.], seq 3169:3705, ack 1, win 32768, options [TS val 1226 ecr 1223,eol], length 536
1.270392 Acknowledgment RA:00:00:00:00:00:05 
1.271381 IP 10.1.1.3.49153 > 10.1.1.1.9999: Flags [.], seq 11209:11745, ack 1, win 32768, options [TS val 1252 ecr 1249,eol], length 536
1.271397 Acknowledgment RA:00:00:00:00:00:03 
1.272358 IP 10.1.1.3.49153 > 10.1.1.1.9999: Flags [.], seq 11745:12281, ack 1, win 32768, options [TS val 1266 ecr 1253,eol], length 536
1.272374 Acknowledgment RA:00:00:00:00:00:03 
1.272461 IP 10.1.1.1.9999 > 10.1.1.2.49153: Flags [.], ack 7457, win 32768, options [TS val 1256 ecr 1237,eol], length 0
1.272665 Acknowledgment RA:00:00:00:00:00:01 
1.273573 IP 10.1.1.3.49153 > 10.1.1.1.9999: Flags [.], seq 12281:12817, ack 1, win 32768, options [TS val 1266 ecr 1253,eol], length 536
1.273589 Acknowledgment RA:00:00:00:00:00:03 
1.274501 IP 10.1.1.4.49153 > 10.1.1.1.9999: Flags [.], seq 16385:16897, ack 1, win 32768, options [TS val 1270 ecr 1255,eol], length 512
1.274517 Acknowledgment RA:00:00:00:00:00:04 
1.275487 IP 10.1.1.2.49153 > 10.1.1.1.9999: Flags [.], seq 10137:10673, ack 1, win 32768, options [TS val 1272 ecr 1256,eol], length 536
1.275503 Acknowledgment RA:00:00:00:00:00:02 
1.276473 IP 10.1.1.3.49153 > 10.1.1.1.9999: Flags [.], seq 12817:13353, ack 1, win 32768, options [TS val 1266 ecr 1253,eol], length 536
1.276489 Acknowledgment RA:00:00:00:00:00:03 
1.276594 IP 10.1.1.1.9999 > 10.1.1.2.49153: Flags [.], ack 8529, win 32768, options [TS val 1259 ecr 1242,eol], length 0
1.276798 Acknowledgment RA:00:00:00:00:00:01 
1.277715 IP 10.1.1.2.49153 > 10.1.1.1.9999: Flags [.], seq 10673:11209, ack 1, win 32768, options [TS val 1272 ecr 1256,eol], length 536
1.277731 Acknowledgment RA:00:00:00:00:00:02 
1.277863 IP 10.1.1.1.9999 > 10.1.1.2.49153: Flags [.], ack 9601, win 32768, options [TS val 1262 ecr 1251,eol], length 0
1.278067 Acknowledgment RA:00:00:00:00:00:01 
1.278975 IP 10.1.1.2.49153 > 10.1.1.1.9999: Flags [.], seq 11209:11745, ack 1, win 32768, options [TS val 1272 ecr 1256,eol], length 536
1.278991 Acknowledgment RA:00:00:00:00:00:02 
1.279930 IP 10.1.1.4.49153 > 10.1.1.1.9999: Flags [.], seq 16897:17409, ack 1, win 32768, options [TS val 1278 ecr 1255,eol], length 512
1.279946 Acknowledgment RA:00:00:00:00:00:04 
1.280889 IP 10.1.1.2.49153 > 10.1.1.1.9999: Flags [.], seq 11745:12281, ack 1, win 32768, options [TS val 1276 ecr 1259,eol], length 536
1.280905 Acknowledgment RA:00:00:00:00:00:02 
1.280992 IP 10.1.1.1.9999 > 10.1.1.3.49153: Flags [.], ack 9601, win 32768, options [TS val 1263 ecr 1246,eol], length 0
1.281196 Acknowledgment RA:00:00:00:00:00:01 
1.282131 IP 10.1.1.3.49153 > 10.1.1.1.9999: Flags [.], seq 13353:13889, ack 1, win 32768, options [TS val 1281 ecr 1263,eol], length 536
1.282147 Acknowledgment RA:00:00:00:00:00:03 
1.283108 IP 10.1.1.2.49153 > 10.1.1.1.9999: Flags [.], seq 12281:12817, ack 1, win 32768, options [TS val 1276 ecr 1259,eol], length 536
1.283124 Acknowledgment RA:00:00:00:00:00:02 
1.283220 IP 10.1.1.1.9999 > 10.1.1.3.49153: Flags [.], ack 10673, win 32768, options [TS val 1267 ecr 1246,eol], length 0
1.283424 Acknowledgment RA:00:00:00:00:00:01 
1.284323 IP 10.1.1.2.49153 > 10.1.1.1.9999: Flags [.], seq 12817:13353, ack 1, win 32768, options [TS val 1276 ecr 1259,eol], length 536
1.284339 Acknowledgment RA:00:00:00:00:00:02 
1.285292 IP 10.1.1.2.49153 > 10.1.1.1.9999: Flags [.], seq 13353:13889, ack 1, win 32768, options [TS val 1278 ecr 1262,eol], length 536
1.285308 Acknowledgment RA:00:00:00:00:00:02 
1.286269 IP 10.1.1.2.49153 > 10.1.1.1.9999: Flags [.], seq 13889:14425, ack 1, win 32768, options [TS val 1278 ecr 1262,eol], length 536
1.286285 Acknowledgment RA:00:00:00:00:00:02 
1.287255 IP 10.1.1.3.49153 > 10.1.1.1.9999: Flags [.], seq 13889:14425, ack 1, win 32768, options [TS val 1281 ecr 1263,eol], length 536
1.287271 Acknowledgment RA:00:00:00:00:00:03 
1.288182 IP 10.1.1.4.49153 > 10.1.1.1.9999: Flags [.], seq 17409:17921, ack 1, win 32768, options [TS val 1286 ecr 1255,eol], length 512
1.288198 Acknowledgment RA:00:00:00:00:00:04 
1.288303 IP 10.1.1.1.9999 > 10.1.1.5.49153: Flags [.], ack 3169, win 32768, options [TS val 1268 ecr 1226,eol], length 0
1.288508 Acknowledgment RA:00:00:00:00:00:01 
1.289416 IP 10.1.1.2.49153 > 10.1.1.1.9999: Flags [.], seq 14425:14961, ack 1, win 32768, options [TS val 1278 ecr 1262,eol], length 536
1.289432 Acknowledgment RA:00:00:00:00:00:02 
1.290375 IP 10.1.1.3.49153 > 10.1.1.1.9999: Flags [.], seq 14425:14961, ack 1, win 32768, options [TS val 1281 ecr 1263,eol], length 536
1.290391 Acknowledgment RA:00:00:00:00:00:03 
1.291344 IP 10.1.1.5.49153 > 10.1.1.1.9999: Flags [.], seq 3705:4241, ack 1, win 32768, options [TS val 1288 ecr 1268,eol], length 536
1.291360 Acknowledgment RA:00:00:00:00:00:05 
1.291447 IP 10.1.1.1.9999 > 10.1.1.3.49153: Flags [.], ack 11745, win 32768, options [TS val 1271 ecr 1252,eol], length 0
1.291651 Acknowledgment RA:00:00:00:00:00:01 
1.292559 IP 10.1.1.3.49153 > 10.1.1.1.9999: Flags [.], seq 14961:15497, ack 1, win 32768, options [TS val 1283 ecr 1267,eol], length 536
1.292575 Acknowledgment RA:00:00:00:00:00:03 
1.292671 IP 10.1.1.1.9999 > 10.1.1.3.49153: Flags [.], ack 12817, win 32768, options [TS val 1273 ecr 1266,eol], length 0
1.292875 Acknowledgment RA:00:00:00:00:00:01 
1.293829 IP 10.1.1.5.49153 > 10.1.1.1.9999: Flags [.], seq 4241:4777, ack 1, win 32768, options [TS val 1288 ecr 1268,eol], length 536
1.293845 Acknowledgment RA:00:00:00:00:00:05 
1.293950 IP 10.1.1.1.9999 > 10.1.1.4.49153: Flags [.], ack 16897, win 32768, options [TS val 1274 ecr 1262,eol], length 0
1.295736 IP 10.1.1.4.49153 > 10.1.1.1.9999: Flags [.], seq 17921:18433, ack 1, win 32768, options [TS val 1294 ecr 1255,eol], length 512
1.295752 Acknowledgment RA:00:00:00:00:00:04 
1.295893 IP 10.1.1.1.9999 > 10.1.1.4.49153: Flags [.], ack 16897, win 32768, options [TS val 1274 ecr 1262,eol], length 0
1.296097 Acknowledgment RA:00:00:00:00:00:01 
1.297005 IP 10.1.1.5.49153 > 10.1.1.1.9999: Flags [.], seq 4777:5313, ack 1, win 32768, options [TS val 1288 ecr 1268,eol], length 536
1.297021 Acknowledgment RA:00:00:00:00:00:05 
1.297171 IP 10.1.1.1.9999 > 10.1.1.2.49153: Flags [.], ack 10673, win 32768, options [TS val 1275 ecr 1251,eol], length 0
1.297375 Acknowledgment RA:00:00:00:00:00:01 
1.298355 IP 10.1.1.2.49153 > 10.1.1.1.9999: Flags [.], seq 14961:15497, ack 1, win 32768, options [TS val 1297 ecr 1275,eol], length 536
1.298371 Acknowledgment RA:00:00:00:00:00:02 
1.298485 IP 10.1.1.1.9999 > 10.1.1.2.49153: Flags [.], ack 11745, win 32768, options [TS val 1278 ecr 1272,eol], length 0
1.300304 IP 10.1.1.2.49153 > 10.1.1.1.9999: Flags [.], seq 15497:16033, ack 1, win 32768, options [TS val 1297 ecr 1275,eol], length 536
1.300320 Acknowledgment RA:00:00:00:00:00:02 
1.300461 IP 10.1.1.1.9999 > 10.1.1.2.49153: Flags [.], ack 11745, win 32768, options [TS val 1278 ecr 1272,eol], length 0
1.300665 Acknowledgment RA:00:00:00:00:00:01 
1.301564 IP 10.1.1.2.49153 > 10.1.1.1.9999: Flags [.], seq 16033:16569, ack 1, win 32768, options [TS val 1297 ecr 1275,eol], length 536
1.301580 Acknowledgment RA:00:00:00:00:00:02 
1.302586 IP 10.1.1.2.49153 > 10.1.1.1.9999: Flags [.], seq 16569:17105, ack 1, win 32768, options [TS val 1300 ecr 1278,eol], length 536
1.302602 Acknowledgment RA:00:00:00:00:00:02 
1.302716 IP 10.1.1.1.9999 > 10.1.1.3.49153: Flags [.], ack 13889, win 32768, options [TS val 1282 ecr 1266,eol], length 0
1.302920 Acknowledgment RA:00:00:00:00:00:01 
1.303837 IP 10.1.1.3.49153 > 10.1.1.1.9999: Flags [.], seq 15497:16033, ack 1, win 32768, options [TS val 1283 ecr 1267,eol], length 536
1.303853 Acknowledgment RA:00:00:00:00:00:03 
1.304765 IP 10.1.1.4.49153 > 10.1.1.1.9999: Flags [.], seq 18433:18945, ack 1, win 32768, options [TS val 1303 ecr 1274,eol], length 512
1.304781 Acknowledgment RA:00:00:00:00:00:04 
1.305742 IP 10.1.1.2.49153 > 10.1.1.1.9999: Flags [.], seq 17105:17641, ack 1, win 32768, options [TS val 1300 ecr 1278,eol], length 536
1.305758 Acknowledgment RA:00:00:00:00:00:02 
1.306701 IP 10.1.1.3.49153 > 10.1.1.1.9999: Flags [.], seq 16033:16569, ack 1, win 32768, options [TS val 1283 ecr 1267,eol], length 536
1.306717 Acknowledgment RA:00:00:00:00:00:03 
1.307705 IP 10.1.1.2.49153 > 10.1.1.1.9999: Flags [.], seq 17641:18177, ack 1, win 32768, options [TS val 1300 ecr 1278,eol], length 536
1.307721 Acknowledgment RA:00:00:00:00:00:02 
1.307808 IP 10.1.1.1.9999 > 10.1.1.2.49153: Flags [.], ack 12817, win 32768, options [TS val 1283 ecr 1276,eol], length 0
1.308012 Acknowledgment RA:00:00:00:00:00:01 
1.308983 IP 10.1.1.3.49153 > 10.1.1.1.9999: Flags [.], seq 16569:17105, ack 1, win 32768, options [TS val 1291 ecr 1271,eol], length 536
1.308999 Acknowledgment RA:00:00:00:00:00:03 
1.309131 IP 10.1.1.1.9999 > 10.1.1.2.49153: Flags [.], ack 13889, win 32768, options [TS val 1285 ecr 1276,eol], length 0
1.310947 IP 10.1.1.3.49153 > 10.1.1.1.9999: Flags [.], seq 17105:17641, ack 1, win 32768, options [TS val 1291 ecr 1271,eol], length 536
1.310963 Acknowledgment RA:00:00:00:00:00:03 
1.311969 IP 10.1.1.2.49153 > 10.1.1.1.9999: Flags [.], seq 18177:18713, ack 1, win 32768, options [TS val 1307 ecr 1283,eol], length 536
1.311985 Acknowledgment RA:00:00:00:00:00:02 
1.312588 IP 10.1.1.3.49153 > 10.1.1.1.9999: Flags [.], seq 17641:17921, ack 1, win 32768, options [TS val 1291 ecr 1271,eol], length 280
1.312604 Acknowledgment RA:00:00:00:00:00:03 
1.312736 IP 10.1.1.1.9999 > 10.1.1.2.49153: Flags [.], ack 13889, win 32768, options [TS val 1285 ecr 1276,eol], length 0
1.312940 Acknowledgment RA:00:00:00:00:00:01 
1.314118 IP 10.1.1.2.49153 > 10.1.1.1.9999: Flags [.], seq 18713:18945, ack 1, win 32768, options [TS val 1307 ecr 1283,eol], length 232
1.314134 Acknowledgment RA:00:00:00:00:00:02 
1.314985 IP 10.1.1.2.49153 > 10.1.1.1.9999: Flags [.], seq 18713:18945, ack 1, win 32768, options [TS val 1307 ecr 1283,eol], length 232
1.315001 Acknowledgment RA:00:00:00:00:00:02 
1.315088 IP 10.1.1.1.9999 > 10.1.1.4.49153: Flags [.], ack 17921, win 32768, options [TS val 1288 ecr 1278,eol], length 0
1.315293 Acknowledgment RA:00:00:00:00:00:01 
1.315372 IP 10.1.1.1.9999 > 10.1.1.2.49153: Flags [.], ack 14961, win 32768, options [TS val 1289 ecr 1278,eol], length 0
1.315576 Acknowledgment RA:00:00:00:00:00:01 
1.316452 IP 10.1.1.4.49153 > 10.1.1.1.9999: Flags [.], seq 18945:19457, ack 1, win 32768, options [TS val 1311 ecr 1274,eol], length 512
1.316468 Acknowledgment RA:00:00:00:00:00:04 
1.317379 IP 10.1.1.2.49153 > 10.1.1.1.9999: Flags [.], seq 18945:19457, ack 1, win 32768, options [TS val 1311 ecr 1283,eol], length 512
1.317395 Acknowledgment RA:00:00:00:00:00:02 
1.318307 IP 10.1.1.3.49153 > 10.1.1.1.9999: Flags [.], seq 17921:18433, ack 1, win 32768, options [TS val 1294 ecr 1273,eol], length 512
1.318323 Acknowledgment RA:00:00:00:00:00:03 
1.319252 IP 10.1.1.3.49153 > 10.1.1.1.9999: Flags [.], seq 18433:18945, ack 1, win 32768, options [TS val 1303 ecr 1282,eol], length 512
1.319268 Acknowledgment RA:00:00:00:00:00:03 
1.320206 IP 10.1.1.3.49153 > 10.1.1.1.9999: Flags [.], seq 18945:19457, ack 1, win 32768, options [TS val 1311 ecr 1282,eol], length 512
1.320222 Acknowledgment RA:00:00:00:00:00:03 
1.320318 IP 10.1.1.1.9999 > 10.1.1.3.49153: Flags [.], ack 14961, win 32768, options [TS val 1290 ecr 1281,eol], length 0
1.322019 IP 10.1.1.2.49153 > 10.1.1.1.9999: Flags [.], seq 19457:19969, ack 1, win 32768, options [TS val 1319 ecr 1289,eol], length 512
1.322035 Acknowledgment RA:00:00:00:00:00:02 
1.322149 IP 10.1.1.1.9999 > 10.1.1.3.49153: Flags [.], ack 14961, win 32768, options [TS val 1290 ecr 1281,eol], length 0
1.322353 Acknowledgment RA:00:00:00:00:00:01 
1.323229 IP 10.1.1.3.49153 > 10.1.1.1.9999: Flags [.], seq 19457:19969, ack 1, win 32768, options [TS val 1319 ecr 1282,eol], length 512
1.323245 Acknowledgment RA:00:00:00:00:00:03 
1.323341 IP 10.1.1.1.9999 > 10.1.1.5.49153: Flags [.], ack 4241, win 32768, options [TS val 1291 ecr 1226,eol], length 0
1.323545 Acknowledgment RA:00:00:00:00:00:01 
1.324471 IP 10.1.1.5.49153 > 10.1.1.1.9999: Flags [.], seq 5313:5849, ack 1, win 32768, options [TS val 1323 ecr 1291,eol], length 536
1.324487 Acknowledgment RA:00:00:00:00:00:05 
1.325449 IP 10.1.1.5.49153 > 10.1.1.1.9999: Flags [.], seq 5849:6385, ack 1, win 32768, options [TS val 1323 ecr 1291,eol], length 536
1.325465 Acknowledgment RA:00:00:00:00:00:05 
1.326418 IP 10.1.1.5.49153 > 10.1.1.1.9999: Flags [.], seq 6385:6921, ack 1, win 32768, options [TS val 1323 ecr 1291,eol], length 536
1.326434 Acknowledgment RA:00:00:00:00:00:05 
1.326548 IP 10.1.1.1.9999 > 10.1.1.5.49153: Flags [.], ack 5313, win 32768, options [TS val 1297 ecr 1288,eol], length 0
1.326752 Acknowledgment RA:00:00:00:00:00:01 
1.327646 IP 10.1.1.4.49153 > 10.1.1.1.9999: Flags [.], seq 19457:19969, ack 1, win 32768, options [TS val 1319 ecr 1288,eol], length 512
1.327662 Acknowledgment RA:00:00:00:00:00:04 
1.328591 IP 10.1.1.3.49153 > 10.1.1.1.9999: Flags [.], seq 19969:20481, ack 1, win 32768, options [TS val 1327 ecr 1290,eol], length 512
1.328607 Acknowledgment RA:00:00:00:00:00:03 
1.328694 IP 10.1.1.1.9999 > 10.1.1.2.49153: Flags [.], ack 16033, win 32768, options [TS val 1300 ecr 1297,eol], length 0
1.328899 Acknowledgment RA:00:00:00:00:00:01 
1.329784 IP 10.1.1.2.49153 > 10.1.1.1.9999: Flags [.], seq 19969:20481, ack 1, win 32768, options [TS val 1327 ecr 1289,eol], length 512
1.329800 Acknowledgment RA:00:00:00:00:00:02 
1.330752 IP 10.1.1.5.49153 > 10.1.1.1.9999: Flags [.], seq 6921:7457, ack 1, win 32768, options [TS val 1326 ecr 1297,eol], length 536
1.330768 Acknowledgment RA:00:00:00:00:00:05 
1.331730 IP 10.1.1.5.49153 > 10.1.1.1.9999: Flags [.], seq 7457:7993, ack 1, win 32768, options [TS val 1326 ecr 1297,eol], length 536
1.331746 Acknowledgment RA:00:00:00:00:00:05 
1.331833 IP 10.1.1.1.9999 > 10.1.1.2.49153: Flags [.], ack 17105, win 32768, options [TS val 1302 ecr 1297,eol], length 0
1.332037 Acknowledgment RA:00:00:00:00:00:01 
1.332904 IP 10.1.1.4.49153 > 10.1.1.1.9999: Flags [.], seq 19969:20481, ack 1, win 32768, options [TS val 1327 ecr 1288,eol], length 512
1.332920 Acknowledgment RA:00:00:00:00:00:04 
1.333891 IP 10.1.1.5.49153 > 10.1.1.1.9999: Flags [.], seq 7993:8529, ack 1, win 32768, options [TS val 1326 ecr 1297,eol], length 536
1.333907 Acknowledgment RA:00:00:00:00:00:05 
1.334003 IP 10.1.1.1.9999 > 10.1.1.3.49153: Flags [.], ack 16033, win 32768, options [TS val 1303 ecr 1283,eol], length 0
1.334207 Acknowledgment RA:00:00:00:00:00:01 
1.334340 IP 10.1.1.1.9999 > 10.1.1.4.49153: Flags [.], ack 18945, win 32768, options [TS val 1304 ecr 1294,eol], length 0
1.334544 Acknowledgment RA:00:00:00:00:00:01 
1.334713 IP 10.1.1.1.9999 > 10.1.1.2.49153: Flags [.], ack 18177, win 32768, options [TS val 1307 ecr 1300,eol], length 0
1.334917 Acknowledgment RA:00:00:00:00:00:01 
1.335050 IP 10.1.1.1.9999 > 10.1.1.3.49153: Flags [.], ack 17105, win 32768, options [TS val 1308 ecr 1283,eol], length 0
1.335255 Acknowledgment RA:00:00:00:00:00:01 
1.335406 IP 10.1.1.1.9999 > 10.1.1.3.49153: Flags [.], ack 17921, win 32768, options [TS val 1312 ecr 1291,eol], length 0
1.335610 Acknowledgment RA:00:00:00:00:00:01 
1.335725 IP 10.1.1.1.9999 > 10.1.1.2.49153: Flags [.], ack 18945, win 32768, options [TS val 1314 ecr 1307,eol], length 0
1.335929 Acknowledgment RA:00:00:00:00:00:01 
1.336841 IP 10.1.1.4.49153 > 10.1.1.1.9999: Flags [.], seq 20481:20993, ack 1, win 32768, options [TS val 1335 ecr 1304,eol], length 512
1.336857 Acknowledgment RA:00:00:00:00:00:04 
1.337769 IP 10.1.1.3.49153 > 10.1.1.1.9999: Flags [.], seq 20481:20993, ack 1, win 32768, options [TS val 1335 ecr 1312,eol], length 512
1.337785 Acknowledgment RA:00:00:00:00:00:03 
1.337899 IP 10.1.1.1.9999 > 10.1.1.3.49153: Flags [.], ack 18945, win 32768, options [TS val 1319 ecr 1294,eol], length 0
1.338103 Acknowledgment RA:00:00:00:00:00:01 
1.338137 IP 10.1.1.1.9999 > 10.1.1.2.49153: Flags [.], ack 19969, win 32768, options [TS val 1322 ecr 1311,eol], length 0
